<?xml version="1.0" encoding="UTF-8"?>
<schema xmlns="http://www.w3.org/2001/XMLSchema" targetNamespace="http://www.example.org/BillSchema" xmlns:tns="http://www.example.org/BillSchema" elementFormDefault="qualified">

    <complexType name="root">
    	<sequence>
    		<element name="call" type="tns:call" maxOccurs="unbounded" minOccurs="0"></element>
    	</sequence>
    </complexType>
    
    <complexType name="call">
    	<sequence>
    		<element name="name" type="string"></element>
    		<element name="telephone" type="integer"></element>
    		<element name="address" type="string"></element>
    		<element name="starttime" type="dateTime"></element>
    		<element name="endtime" type="dateTime"></element>
    		<element name="charge" type="decimal"></element>
    	</sequence>
    </complexType>


    <element name="root" type="tns:root"></element>
</schema>