<?xml version="1.0" encoding="UTF-8"?>
<tns:root xmlns:tns="http://www.example.org/BillSchema"
	xmlns:xsi="http://www.w3.org/2001/XMLSchema-instance"
	xsi:schemaLocation="http://www.example.org/BillSchema schema/BillSchema.xsd ">
	<tns:call>
		<tns:name>rikugun</tns:name>
		<tns:telephone>18677180402</tns:telephone>
		<tns:address>南京</tns:address>
		<tns:starttime>2001-12-31T12:13:07</tns:starttime>
		<tns:endtime>2001-12-31T12:25:10</tns:endtime>
		<tns:charge>12.00</tns:charge>
	</tns:call>
	<tns:call>
		<tns:name>rikugun</tns:name>
		<tns:telephone>18677180402</tns:telephone>
		<tns:address>南京</tns:address>
		<tns:starttime>2001-12-31T12:13:07</tns:starttime>
		<tns:endtime>2001-12-31T12:25:10</tns:endtime>
		<tns:charge>12.00</tns:charge>
	</tns:call>
	<tns:call>
		<tns:name>rikugun</tns:name>
		<tns:telephone>18677180402</tns:telephone>
		<tns:address>南京</tns:address>
		<tns:starttime>2001-12-31T12:13:07</tns:starttime>
		<tns:endtime>2001-12-31T12:25:10</tns:endtime>
		<tns:charge>12.00</tns:charge>
	</tns:call>
	<tns:call>
		<tns:name>rikugun</tns:name>
		<tns:telephone>18677180402</tns:telephone>
		<tns:address>南京</tns:address>
		<tns:starttime>2001-12-31T12:13:07</tns:starttime>
		<tns:endtime>2001-12-31T12:25:10</tns:endtime>
		<tns:charge>12.00</tns:charge>
	</tns:call>
	<tns:call>
		<tns:name>rikugun</tns:name>
		<tns:telephone>18677180402</tns:telephone>
		<tns:address>南京</tns:address>
		<tns:starttime>2001-12-31T12:13:07</tns:starttime>
		<tns:endtime>2001-12-31T12:25:10</tns:endtime>
		<tns:charge>12.00</tns:charge>
	</tns:call>
	<tns:call>
		<tns:name>rikugun</tns:name>
		<tns:telephone>18677180402</tns:telephone>
		<tns:address>南京</tns:address>
		<tns:starttime>2001-12-31T12:13:07</tns:starttime>
		<tns:endtime>2001-12-31T12:25:10</tns:endtime>
		<tns:charge>12.00</tns:charge>
	</tns:call>
	<tns:call>
		<tns:name>rikugun</tns:name>
		<tns:telephone>18677180402</tns:telephone>
		<tns:address>南京</tns:address>
		<tns:starttime>2001-12-31T12:13:07</tns:starttime>
		<tns:endtime>2001-12-31T12:25:10</tns:endtime>
		<tns:charge>12.00</tns:charge>
	</tns:call>
	<tns:call>
		<tns:name>rikugun</tns:name>
		<tns:telephone>18677180402</tns:telephone>
		<tns:address>南京</tns:address>
		<tns:starttime>2001-12-31T12:13:07</tns:starttime>
		<tns:endtime>2001-12-31T12:25:10</tns:endtime>
		<tns:charge>12.00</tns:charge>
	</tns:call>
	<tns:call>
		<tns:name>rikugun</tns:name>
		<tns:telephone>18677180402</tns:telephone>
		<tns:address>南京</tns:address>
		<tns:starttime>2001-12-31T12:13:07</tns:starttime>
		<tns:endtime>2001-12-31T12:25:10</tns:endtime>
		<tns:charge>12.00</tns:charge>
	</tns:call>


</tns:root>
